<?xml version="1.0" encoding="UTF-8"?>
<!DOCTYPE banque SYSTEM "correspondances.dtd">

<banque date_version="2016-10-17" modelisation="Isabelle Bastien">
    
    <!-- balisage orienté présentation-->
    
    <correspondance>
        <el_erudit valeur="italique">marquage/@typemarq</el_erudit>
        <el_jats>italics</el_jats>
        <type_correspondance><parfaite/></type_correspondance>
    </correspondance>
    <correspondance>
        <el_erudit>article</el_erudit>
        <el_jats>article</el_jats>
        <type_correspondance><specifique/></type_correspondance>
    </correspondance>
    <correspondance>
        
        <el_erudit>article/@idproprio</el_erudit>
        <el_jats></el_jats>

        <type_correspondance></type_correspondance>
    </correspondance>
</banque>